,Sitio,name,website,address,phone,city,Price,Email 1,Email 2,Email 3,Email 4,Email 5
1,Booking,Villas Argan - Paradise Gateway,https://villasargan.com/,"Playa Hermosa - Manzanillo Beach Rd, Puntarenas Province, Puntarenas, Costa Rica",,Puntarenas,>300.000 ARS,info@villasargan.com,,,,
1,Booking,Tamarindo Village Hotel,http://tamarindovillage.com/,"100 metres south of hotel Arco Iris, Guanacaste Province, Tamarindo, 50309, Costa Rica",+506 2653 0036,Tamarindo,>300.000 ARS,tamarindo.village.cr@gmail.com,,,,
1,Booking,Latica Lodge,http://www.laticalodge.com/,"Finca Los Pargos 50m S. From Super Las Tecas & 800m SE Guanacaste Santa Cruz, 50303, Costa Rica",+506 2101 2237,Santa Cruz,>300.000 ARS,info@laticalodge.com,info.laticalodge@gmail.com,,,
1,Booking,Leyenda Boutique Hotel & Spa,https://www.hotelleyenda.com/,"2 km este de playa carrillo Guanacaste Puerto Carrillo, Hojancha, 51103, Costa Rica",+506 4002 2790,Hojancha,>300.000 ARS,info@maralahotel.com,reservas@hotelleyenda.com,,,
1,Booking,"Balmoral Hotel San José CR, Historic District",http://www.balmoral.co.cr/,"Av. Central, San José, El Carmen, 10303, Costa Rica",+506 2222 5022,El Carmen,>300.000 ARS,reservas@balmoral.co.cr,,,,
1,Booking,Esh Hotel - Adults Only,https://www.eshhotel.com/,"50206, Provincia de Guanacaste, Nosara, 50206, Costa Rica",+506 8722 5999,Nosara,>300.000 ARS,hola@eshhotel.com,,,,
1,Booking,Hotel La Mansion Inn Arenal,https://www.mansionarenal.com/,"Provincia de Guanacaste, Nuevo Arenal, Costa Rica",+506 8642 1552,Nuevo Arenal,>300.000 ARS,lamansionarenal@gmail.com,,,,
1,Booking,Les Voiles Blanches - Luxury Lodge,https://www.lesvoilesblanchestamarindo.com/,"152 Rio Santo, C. Hernandez, Provincia de Guanacaste, Tamarindo, Rio Santo, 50309, Costa Rica",+506 6325 0025,Rio Santo,>300.000 ARS,lesvoilesblanchestamarindo@gmail.com,,,,
1,Booking,The Retreat Costa Rica - Wellness Resort & Spa,https://www.theretreatcostarica.com/,"Entrada de adoquín, Atenas, Barrio Jesús 700 metros Oeste de la entrada de Barroeta, Alajuela Province, Atenas, Costa Rica",+506 2106 3900,Atenas,>300.000 ARS,info@theretreatcostarica.com,,,,
1,Booking,Pumilio Mountain & Ocean Hotel,http://www.hotelpumilio.com/,"2km Este Cruce de Herradura 1 km Norte, Jaco, 10000, Costa Rica",+506 6105 5678,Jaco,>300.000 ARS,info@hotelpumilio.com,,,,
1,Booking,Amor Arenal Adults Friendly,http://www.amorarenal.com/,"7 km oeste del centro de La Fortuna en la Ruta 142 camino al, Parque Nacional Volcán Arenal, Provincia de Alajuela, La Fortuna, 21007, Costa Rica",+506 2479 7070,La Fortuna,>300.000 ARS,reservations@amorarenal.com,,,,
1,Booking,The Backyard Beachfront Hotel,http://www.backyardhotel.com/,"Playa de Jaco, Provincia de Puntarenas, Jacó, Costa Rica",+506 8354 9511,Jacó,>300.000 ARS,backyardhotel01@gmail.com,BACKYARDHOTEL01@GMAIL.COM,,,
1,Booking,Drake Bay Greenleaf,http://drakebaygreenleaf.com/,"Bahía Drake, Drake Bay Greenleaf, Puntarenas Province, 60503, Costa Rica",+506 8826 8024,Drake,>300.000 ARS,reservations@drakebaygreenleaf.com,,,,
1,Booking,Tiki Villas Rainforest Lodge - Adults Only,http://www.tikivillas.com/,"12km South of Dominical, Provincia de Puntarenas, Dominical, 60504, Costa Rica",+506 4070 9207,Dominical,>300.000 ARS,info@TikiVillas.com,,,,
1,Booking,Montaña de Fuego All Inclusive,https://montanadefuego.com/es/,"5 miles west from La Fortuna Central Park, 142 route, Provincia de Alajuela, La Fortuna, 5510, Costa Rica",+506 2479 1220,La Fortuna,>300.000 ARS,info@montanadefuego.com,Info@montanadefuego.com,,,
1,Booking,Pacific Kalokairi - Adults Only,http://www.pacifickalokairi.com/,"Tamarindo 2km este del banco nacional, residencial monte grande, 11c Guanacaste, Santa cruz, Tamarindo, 50309, Costa Rica",+506 8831 4531,Tamarindo,>300.000 ARS,info@pacifickalokairi.com,,,,
1,Booking,Boutique Hotel Las Cascadas,https://www.lascascadasthefalls.com/?utm_source=google&utm_medium=organic&utm_campaign=gmb,"Road to La Marina Pez Vela, 250 mts west, Zona Americana, Tipo H, Provincia de Puntarenas, Quepos, 60601, Costa Rica",+1 888-695-7583,Quepos,>300.000 ARS,Reservations@lascascadasthefalls.com,,,,
1,Booking,Namuwoki Lodge,https://www.namuwokilodge.com/,"Limón, Punta Cocles, Costa Rica",+506 2750 0278,Punta Cocles,>300.000 ARS,info@mysite.com,namuwoki@namuwoki.com,,,
1,Booking,Fondavela Hotel,https://fondavela.com/,"75XV+M8V, 620 Road Puntarenas Monteverde, Monteverde, 60109, Costa Rica",+506 2645 5125,Monteverde,>300.000 ARS,stay@fondavela.com,,,,
1,Booking,Parque del Lago Boutique Hotel,https://www.parquedellago.com/,"50 metros este de la entrada principal de, P.º Colón, San José, San Francisco, 10108, Costa Rica",+506 4000 2020,San Francisco,>300.000 ARS,info@parquedellago.com,,,,
1,Booking,Peace Lofts and Apartments,https://peaceloft.com/,"Peace Lofts Santa Teresa 1km norte del cruces Puntarenas, 60111, Costa Rica",+506 2100 4316,Santa Teresa,>300.000 ARS,peaceloft@gmail.com,,,,
1,Booking,Hotel Guiones,http://www.hotelguiones.com/,"200 metros Coconut Harry's, Provincia de Guanacaste, Nosara, 50206, Costa Rica",+506 8409 8120,Nosara,>300.000 ARS,hello@nosaragardens.com,,,,
1,Booking,Hacienda Guachipelin Volcano Ranch Hotel & Hot Springs,http://www.guachipelin.com/,"208-50101 Guanacaste Curubande, Liberia, Costa Rica",+506 2690 2900,Liberia,>300.000 ARS,info@guachipelin.com,,,,
1,Booking,Hotel Villabosque Eco Boutique,http://www.hotelvillabosque.com/,"Parque Nacional Manuel Antonio, 300 mts oeste del, Provincia de Puntarenas, Quepos, 60601, Costa Rica",+506 8584 2482,Quepos,>300.000 ARS,info@hotelvillabosque.com,,,,
1,Booking,Tierra Magnifica Boutique Hotel,http://www.tierramagnifica.com/?utm_source=google&utm_medium=organic&utm_campaign=gmb,"Proyecto Americano Las Huacas, Lote EE90 Provincia de Guanacaste Nosara, Nicoya, 50206, Costa Rica",+1 800-600-0881,Nicoya,>300.000 ARS,Reservations@TierraMagnifica.com,,,,
1,Booking,Rio Perdido Hotel & Thermal River,http://www.rioperdido.com/?utm_source=google&utm_medium=gmb,"East from San Bernardo soccer field, 4 km, Provincia de Guanacaste, Bagaces, 50401, Costa Rica",+506 2673 3600,Bagaces,>300.000 ARS,info@rioperdido.com,,,,
1,Booking,Hotel Villa Los Candiles,http://www.hotelvillaloscandiles.com/,"Quintas Don Lalo, San José, Santa Ana, Costa Rica",+506 2282 8280,Santa Ana,>300.000 ARS,frontdesk@hotelvillaloscandiles.com,,,,
1,Booking,Apartahotel Playa Luna,https://www.facebook.com/PlayaLunaUvita?mibextid=ZbWKwL,"Aparta hotel Playa Luna, Provincia de Puntarenas, Uvita, 60504, Costa Rica",+506 8587 4276,Uvita,>300.000 ARS,hralejo2@gmail.com,,,,
1,Booking,"Mother Earth Luxury Boutique Hotel, Restaurant & Spa",http://www.meveganhotel.com/,"100 meters west of AYA, Guanacaste Province, Tamarindo, Costa Rica",+506 8791 8402,Tamarindo,>300.000 ARS,reservations@meveganhotel.com,,,,
1,Booking,NATURA Loft Garden,http://www.naturast.com/,"100 m south from football field, Puntarenas Province, Beach, 60111, Costa Rica",+506 8689 4774,Puntarenas,>300.000 ARS,info@naturast.com,,,,
1,Booking,Valle Escondido Nature Reserve Hotel & Farm,https://www.valleescondidocr.com/,"100 meters West of Monteverde Butterfly Garden Puntarenas Monteverde, 60109, Costa Rica",+506 2645 5156,Monteverde,>300.000 ARS,reservations@valleescondidocr.com,,,,
1,Booking,Blue Window Boutique Villas Hotel,http://bluewindowcr.com/,"50 mts Norte de carretera 928, Provincia de Guanacaste, Playa junquillal, 50301, Costa Rica",+506 6328 6081,Playa junquillal,>300.000 ARS,bluewindow.junquillal@gmail.com,,,,
1,Booking,Vayu Retreat Villas,http://www.vayucostarica.com/,"3km East from Costanera Pacifica Hwy Puntarenas Tres Rios de Coronado, 60501, Costa Rica",+506 4070 0604,Puntarenas,>300.000 ARS,example@email.com,vayuretreatvillas@gmail.com,,,
1,Booking,Alma de Ojochal,http://www.almacr.com/,"1.5 kilometro este sobre la Calle Perezoso en Ojochal, Ojochal, Costa Rica",,Ojochal,>300.000 ARS,info@almacr.com,,,,
1,Booking,Boutique Hotel Luna Azul,http://www.hotellunaazul.com/,"400 metros al este del cruce hacia Pachamama, Guanacaste Province, San Juanillo, 50306, Costa Rica",+506 2682 1400,San Juanillo,>300.000 ARS,info@example.com,info@hotellunaazul.com,,,
1,Booking,Rancho Pacifico - Boutique Hotel for Adults,https://ranchopacifico.com/?utm_source=gbp&utm_medium=organic&utm_campaign=gbp&utm_content=weblink,"1 Rancho Pacifico Road, Provincia de Puntarenas, Uvita, 00000, Costa Rica",+1 800-460-2383,Uvita,>300.000 ARS,Reservations@RanchoPacifico.com,,,,
1,Booking,Apartotel Flamboyant,https://www.apartotelflamboyant.com/en/,"Provincia de Puntarenas, Jacó, Costa Rica",+506 2643 3146,Jacó,>300.000 ARS,reservaciones@apartotelflamboyant.com,,,,
1,Booking,Olas Verdes Hotel,http://www.olasverdeshotel.com/,"500m West and 350m South from Organico Market, Provincia de Guanacaste, Nosara, 50206, Costa Rica",+506 2682 0608,Nosara,>300.000 ARS,info@olasverdeshotel.com,,,,
1,Booking,Los Altos de Eros - Adults Only,http://www.losaltosdeeros.com/,"Cañafistola, Provincia de Guanacaste, Santa Cruz, Costa Rica",+506 8850 4222,Santa Cruz,>300.000 ARS,info@losaltosdeeros.com,,,,
1,Booking,Hotel Villas Lirio,http://www.villaslirio.com/,"CR5W+WW5, 50 m Norte de la Escuela Bilingue de Manuel Antonio Justo en la entrada principal del Bario Lirio en Manuel Antonio Next to Manuel Antonio School in Manuel Manuel Antonio Puntarenas Quepos, Provincia de Puntarenas, Quepos, 60601, Costa Rica",+506 2777 1182,Quepos,>300.000 ARS,reservations@villaslirio.com,treservations@villaslirio.com,gerencia@villaslirio.com,,
1,Booking,CC Beach Front Papagayo All Inclusive,https://www.ccbeachfrontpapagayo.com/,"Golfo Papagayo, Provincia de Guanacaste, Playa Panama, 50503, Costa Rica",+506 2586 7300,Papagayo,>300.000 ARS,reservaciones@ccbeachfrontpapagayo.com,reservaciones@grupocasaconde.com,,,
1,Booking,El Nido Jungle Lodge,https://www.elnidolodge.com/?utm_source=google-gm&utm_medium=gm-listing&utm_campaign=gm-listing&utm_id=gm-listing,"Playa Chiquita, Puerto Viejo, Limón, Punta Cocles, Costa Rica",+506 8915 2462,Punta Cocles,>300.000 ARS,reservaciones@elnidolodge.com,,,,
1,Booking,Zulu Surf Hotel Tamarindo,https://www.zulusurfhoteltamarindo.com/es/,"Centro Comercial Plaza Conchal Guanacaste Tamarindo, 00506, Costa Rica",+506 8365 9580,Tamarindo,>300.000 ARS,emilia.triana@mercaditotama.com,,,,
1,Booking,Encanto Del Mar Hotel,https://encantodelmarcr.com/,"Avenida Pastor Díaz Garabito - Puntarenas, 61101, Costa Rica",506 8362 9777,Puntarenas,>300.000 ARS,info@encantodelmarcr.com,encantodelmarcr@gmail.com,,,
1,Booking,Colina Secreta - Glamping and Villas,http://colinasecreta.com/,"Calle Margarita km 1, 6 Cocles Beach 70403, Limón, Puerto Viejo de Talamanca, 70403, Costa Rica",+506 8350 9066,Puerto Viejo de Talamanca,>300.000 ARS,info@colinasecreta.com,,,,
1,Booking,The Sunset Shack,http://www.sunsetshackhotel.com/,"Guiones Beach, Guanacaste Province, Nosara, 50206, Costa Rica",+506 2682 0527,Nosara,>300.000 ARS,reservations@sunsetshackhotel.com,,,,
1,Booking,Las Brisas Resort and Villas,https://lasbrisasresortandvillas.com/,"de, Calle Vista Lapas & Calle Hermosa, 800m Este de Costanera Puntarenas Playa Hermosa, Jacó, 61101, Costa Rica",+506 6004 0304,Jacó,>300.000 ARS,reservations@lasbrisasresortandvillas.com,,,,
1,Booking,Natural Drake Bay Hotel Boutique,http://naturaldrakebayhotel.com/,"P963+R95, Provincia de Puntarenas, Rancho Quemado, El Progresso, 60506, Costa Rica",+506 8367 5454,El Progresso,>300.000 ARS,reservaciones@naturaldrakebayhotel.com,,,,
1,Booking,Blue River Resort & Hot Springs,http://www.blueriverresort.com/?utm_source=google&utm_medium=Local&utm_campaign=Google+My+Business,"de, 600 metros norte del antiguo mariposario, Provincia de Alajuela, El Gavilan, 21306, Costa Rica",+506 2200 5700,El Gavilan,>300.000 ARS,info@bluerivercr.com,,,,
1,Booking,Playa Negra Home's CR,https://playanegrahomescr.com/,"M667+6R, Limón, Puerto Viejo de Talamanca, Costa Rica",+506 8303 2094,Puerto Viejo de Talamanca,>300.000 ARS,playanegrahomescr@gmail.com,,,,
1,Booking,Boutique Rooms at La Junta,https://www.lajuntadominical.com/,"Across from the soccer field, Provincia de Puntarenas, Dominical, 60504, Costa Rica",+506 8983 8759,Dominical,>300.000 ARS,lajuntadominical@gmail.com,,,,
1,Booking,Iguana Lodge Beach Resort,http://iguanalodge.com/,"C. a Calle Platanares, Provincia de Puntarenas, Puerto Jiménez, Costa Rica",+506 8829 5865,Puerto Jiménez,>300.000 ARS,info@iguanalodge.com,,,,
1,Booking,Norte Nosara - Steps to Playa Guiones,http://nortenosara.com/,"Provincia de Guanacaste, Nosara, Costa Rica",+506 8578 1010,Nosara,>300.000 ARS,info@nortenosara.com,retreats@nortenosara.com,,,
1,Booking,Way To Heaven Glamping,https://waytoheavenglamping.com/,"Provincia de Puntarenas, Monteverde, Costa Rica",+506 8722 0606,Monteverde,>300.000 ARS,gabriel.marcelo87@gmail.com,waytoheavenglamping@gmail.com,,,
1,Booking,Lapa Rios Lodge by Böëna,https://www.laparios.com/,"Provincia de Puntarenas, Punto Jimenez, Costa Rica",+1 800-963-1195,Punto Jimenez,>300.000 ARS,info@laparios.com,,,,
1,Booking,Encanta La Vida,http://www.encantalavida.com/,"Provincia de Puntarenas, Matapalo, Playa Matapalo, 00000, Costa Rica",+506 8376 3209,Matapalo,>300.000 ARS,reservations@encantalavida.com,,,,
1,Booking,Ride On Beach House,http://www.rideonnosara.com/,"calle que hace esquina con Surf Simply, ultima propiedad Guanacaste Nosara, 50206, Costa Rica",+506 4701 2582,Nosara,>300.000 ARS,rideonnosara@gmail.com,,,,
1,Booking,Vista Condor Lodge,http://www.vistacondorlodge.com/,"4 kms al suroeste de la escuela de Matapalo de Santa Cruz Guanacaste Playa Puerto Viejo (Conchal) de Matapalo de Santa Cruz, 50308, Costa Rica",,Matapalo,>300.000 ARS,info@condorlodgecr.com,,,,
1,Booking,Hotel Adventure Lodge,https://www.adventurelodgejaco.com/es/,"500 metros este heladería Pops, C. Lapa Verde, Provincia de Puntarenas, Jacó, 61101, Costa Rica",+506 8731 9714,Jacó,>300.000 ARS,fvargas06920@gmail.com,,,,
1,Booking,Drake Bay Getaway Resort by Sandglass,http://www.drakebaygetaway.com/,"Osa Peninsula Puntarenas Drake Bay, Costa Rica",+506 6005 7822,Osa,>300.000 ARS,info@drakebaygetaway.com,,,,
,,,,,,,,,,,,
,,,,,,,,,,,,
,,,,,,,,,,,,
170,,,,,,,,,,,,